{
  "title": "Fort Lauderdale Logistics Center",
  "slug": "fort-lauderdale-logistics-center", 
  "price": "$12.75/sq ft/year",
  "size": 75000,
  "location": "Fort Lauderdale, FL",
  "address": "3400 SW 42nd Avenue, Fort Lauderdale, FL 33312",
  "features": [
    "30ft Clear Height",
    "24 Loading Docks",
    "Grade Level Doors",
    "ESFR Sprinkler System",
    "Energy Efficient LED Lighting",
    "Executive Office Suite",
    "Employee Parking",
    "Near Port Everglades"
  ],
  "images": [
    "https://images.unsplash.com/photo-1566228015668-4c45dbc4e2f5?w=800&h=600&fit=crop",
    "https://images.unsplash.com/photo-1581244277943-fe4a9c777189?w=800&h=600&fit=crop"
  ],
  "description": "Strategically located logistics facility just minutes from Port Everglades and Fort Lauderdale International Airport. This state-of-the-art warehouse features modern infrastructure, extensive loading capabilities, and premium office space. Ideal for import/export operations, e-commerce fulfillment, and regional distribution.",
  "availability": "available",
  "featured": true,
  "createdAt": "2025-01-10"
}
