{
  "title": "Miami Industrial Park - Building A",
  "slug": "miami-industrial-park-building-a",
  "price": "$14.50/sq ft/year",
  "size": 45000,
  "location": "Miami, FL",
  "address": "2150 NW 7th Street, Miami, FL 33125",
  "features": [
    "32ft Clear Height",
    "16 Loading Docks",
    "ESFR Sprinkler System",
    "LED Lighting Throughout",
    "Office Space Included",
    "24/7 Security",
    "Rail Access Available"
  ],
  "images": [
    "https://images.unsplash.com/photo-1586528116311-ad8dd3c8310d?w=800&h=600&fit=crop",
    "https://images.unsplash.com/photo-1577495508048-b635879837f1?w=800&h=600&fit=crop",
    "https://images.unsplash.com/photo-1581244277943-fe4a9c777189?w=800&h=600&fit=crop"
  ],
  "description": "Premier industrial facility located in the heart of Miami's industrial corridor. This modern warehouse offers exceptional clear height, multiple loading positions, and immediate access to major highways. Perfect for distribution, manufacturing, or logistics operations. The facility includes modern office space and is situated in a secure, well-maintained industrial park.",
  "availability": "available",
  "featured": true,
  "createdAt": "2025-01-15"
}